name,loyalty_tier,dietary_restrictions,preferences,age_group,visit_purpose
Sarah Chen,Black,"Vegetarian, Gluten-Free","Romantic settings, wine enthusiast, spa lover",35-44,Anniversary celebration
Marcus Al-Rashid,Black,"Nut Allergy, Halal","Fine dining, cultural experiences, quiet atmosphere",45-54,Business & leisure
Emma Rodriguez,Platinum,None,"Nightlife, dancing, adventurous eater, energetic",25-34,Girls weekend
James Harrison,Platinum,Shellfish Allergy,"Steakhouses, bourbon, sports, casual dining",55-64,Golf trip
Priya Sharma,Black,Vegan,"Wellness, healthy food, scenic views, relaxation",30-39,Wellness retreat
